{
  "schema_version": "1.1",
  "client_id": "sample_co_delta",
  "case_id": "sample_case_delta_mode_b_001",
  "product": {
    "name": "구독형 서비스",
    "pricing_model": "recurring",
    "price_components": [
      {
        "component_id": "main",
        "type": "recurring_monthly",
        "actual_price": null,
        "currency": "KRW",
        "price_includes_vat": true,
        "discount_rate": 0.10
      }
    ]
  },
  "tax": { "vat_rate": 0.10 },
  "fx": { "base_currency": "KRW", "reporting_currency": "KRW", "rate_base_per_reporting": 1 },
  "costs": {
    "items": [
      { "item_id": "fixed_cost", "label": "고정형 원가·비용 합계", "cost_category": "product_service_direct_cost",
        "amount": 10000, "rate": null, "currency": "KRW", "basis": "per_unit_per_month", "applies_to_component": "main" },
      { "item_id": "channel_fee", "label": "채널수수료", "cost_category": "variable_selling_delivery",
        "amount": null, "rate": 0.10, "currency": null, "basis": "rate_of_net_sales", "applies_to_component": "main" },
      { "item_id": "pg_fee", "label": "PG수수료", "cost_category": "variable_selling_delivery",
        "amount": null, "rate": 0.03, "currency": null, "basis": "rate_of_gross_payment", "applies_to_component": "main" }
    ]
  },
  "targets": { "target_contribution_margin_rate": 0.30 },
  "meta": {
    "entered_by": "sample",
    "entered_at": "2026-09-11",
    "notes": "교육용 샘플 데이터 — 실제 기업 데이터 아님. docs/features/mode_b_target_price/CASE.md의 Sample Co. Delta 시나리오(TC4/TC6)와 동일한 수치. actual_price는 MODE B가 역산할 값이라 아직 null(미확정)이다 — MODE A는 이 컴포넌트에 대해 UNKNOWN을 낼 것이고, 그것이 MODE B가 존재하는 이유다."
  }
}
