{
  "schema_version": "1.1",
  "client_id": "sample_co_alpha",
  "case_id": "sample_case_alpha_001",
  "product": {
    "name": "프리미엄 텀블러",
    "pricing_model": "one_time",
    "price_components": [
      {
        "component_id": "main",
        "type": "one_time",
        "actual_price": 35000,
        "currency": "KRW",
        "price_includes_vat": true,
        "evidence": {
          "source_type": "internal_spreadsheet",
          "source_ref": "2026 가격표.xlsx",
          "as_of_date": "2026-08-01",
          "verification_status": "confirmed"
        }
      }
    ]
  },
  "tax": { "vat_rate": 0.10 },
  "fx": { "base_currency": "KRW", "reporting_currency": "KRW", "rate_base_per_reporting": 1 },
  "costs": {
    "items": [
      { "item_id": "material_cost", "label": "자재원가", "cost_category": "product_service_direct_cost",
        "amount": 12000, "rate": null, "currency": "KRW", "basis": "per_unit", "applies_to_component": "main" },
      { "item_id": "packaging", "label": "포장비", "cost_category": "product_service_direct_cost",
        "amount": 1500, "rate": null, "currency": "KRW", "basis": "per_unit", "applies_to_component": "main" },
      { "item_id": "pg_fee", "label": "PG수수료", "cost_category": "variable_selling_delivery",
        "amount": null, "rate": 0.025, "currency": null, "basis": "rate_of_gross_payment", "applies_to_component": "main" },
      { "item_id": "shipping", "label": "배송비", "cost_category": "variable_selling_delivery",
        "amount": 3000, "rate": null, "currency": "KRW", "basis": "per_order", "applies_to_component": "main" },
      { "item_id": "sga", "label": "판관비", "cost_category": "fixed_operating_cost",
        "amount": 2000000, "rate": null, "currency": "KRW", "basis": "per_month", "applies_to_component": "shared",
        "allocation_rule": "blended_only" }
    ]
  },
  "targets": { "target_contribution_margin_rate": null },
  "meta": {
    "entered_by": "sample",
    "entered_at": "2026-09-11",
    "notes": "교육용 샘플 데이터 — 실제 기업 데이터 아님. MODE A의 가장 단순한 완전-입력 케이스."
  }
}
